{
  "$schema": "https://json-schema.org/draft/2020-12/schema",
  "$id": "https://prm.dev/schemas/prm-authorization-v1.schema.json",
  "title": "PRM Authorization (Exception Grant) v1",
  "description": "A signed, scoped, expiring grant from an individual to one named organization, carving an exception out of that individual's Personal Data Policy. Digest = SHA-256(JCS(doc minus 'id' and 'proof')); signature domain prefix 'PRM-AUTHZ-v1\\x00'.",
  "type": "object",
  "required": ["@context", "type", "policyChainId", "boundPolicyHash", "grantee", "purposes", "categories", "issued", "expires", "proof"],
  "additionalProperties": false,
  "properties": {
    "@context": {
      "type": "array",
      "prefixItems": [
        { "const": "https://www.w3.org/ns/credentials/v2" },
        { "const": "https://prm.dev/ns/policy/v1" }
      ],
      "items": { "type": "string", "format": "uri" }
    },
    "type": { "type": "array", "contains": { "const": "PRMAuthorization" }, "items": { "type": "string" } },
    "id": { "type": "string", "pattern": "^urn:prm:authz:u[A-Za-z0-9_-]{40,}$" },

    "policyChainId": { "type": "string", "pattern": "^urn:prm:chain:u[A-Za-z0-9_-]{40,}$" },
    "boundPolicyHash": {
      "$ref": "#/$defs/multihash",
      "description": "The exact policy version this grant modifies. A new policy version does not silently re-scope an existing grant."
    },

    "grantee": {
      "type": "object",
      "required": ["name"],
      "additionalProperties": false,
      "properties": {
        "name": { "type": "string", "maxLength": 256 },
        "id": { "type": "string", "description": "Organization DID, domain, or PRM org id." },
        "did": { "type": "string", "pattern": "^did:" },
        "domain": { "type": "string" },
        "contact": { "type": "string", "format": "email" }
      }
    },

    "subjectRef": {
      "type": "object",
      "additionalProperties": false,
      "description": "How the grantee locates this person in their own records. Pairwise by default.",
      "properties": {
        "pairwiseId": {
          "type": "string",
          "description": "HKDF(S_bind, 'prm/v1/pairwise' || granteeId) — unique to this relationship, uncorrelatable across grantees."
        },
        "disclosedIdentifiers": {
          "type": "array",
          "items": {
            "type": "object",
            "required": ["namespace", "value", "salt"],
            "additionalProperties": false,
            "properties": {
              "namespace": { "type": "string" },
              "value": { "type": "string" },
              "salt": { "type": "string", "description": "base64url; opens the matching identifierCommitment in the policy." }
            }
          },
          "description": "Selective disclosure. Only present when the grantee genuinely needs the raw identifier."
        }
      }
    },

    "purposes": { "type": "array", "minItems": 1, "items": { "type": "string" } },
    "categories": {
      "type": "array",
      "minItems": 1,
      "items": { "type": "string" },
      "description": "Processing categories permitted by this grant, overriding the base policy for this grantee only."
    },
    "dataCategories": {
      "type": "array",
      "items": { "type": "string" },
      "description": "Which classes of data the grant covers, e.g. 'location', 'plate-read', 'contact'."
    },

    "issued": { "$ref": "#/$defs/utcInstant" },
    "notBefore": { "$ref": "#/$defs/utcInstant" },
    "expires": {
      "$ref": "#/$defs/utcInstant",
      "description": "REQUIRED. Perpetual grants are not expressible by design; re-grant instead."
    },

    "maxRetention": { "type": "string", "pattern": "^P(?!$)(\\d+Y)?(\\d+M)?(\\d+W)?(\\d+D)?(T(?=\\d)(\\d+H)?(\\d+M)?(\\d+S)?)?$" },
    "onwardSharing": { "enum": ["prohibited", "processors-only", "named-only"], "default": "prohibited" },
    "onwardRecipients": { "type": "array", "items": { "type": "string" } },

    "revocation": {
      "type": "object",
      "required": ["statusListCredential", "statusListIndex"],
      "additionalProperties": false,
      "properties": {
        "statusListCredential": { "type": "string", "format": "uri" },
        "statusListIndex": { "type": "integer", "minimum": 0 },
        "statusPurpose": { "const": "revocation" }
      },
      "description": "W3C Bitstring Status List v1.0 entry. Absence of a status list means the grantee cannot check revocation and MUST honour 'expires' strictly."
    },

    "receiptRequested": { "type": "boolean", "default": true },
    "note": { "type": "string", "maxLength": 2000 },

    "proof": { "$ref": "https://prm.dev/schemas/prm-policy-v1.schema.json#/$defs/dataIntegrityProof" }
  },
  "$defs": {
    "multihash": { "type": "string", "pattern": "^u[A-Za-z0-9_-]{40,}$" },
    "utcInstant": { "type": "string", "pattern": "^\\d{4}-\\d{2}-\\d{2}T\\d{2}:\\d{2}:\\d{2}Z$" }
  }
}
