{
  "@context": [
    "https://www.w3.org/ns/credentials/v2",
    "https://rightsroot.org/spec/prm/ns/v1"
  ],
  "type": [
    "VerifiableCredential",
    "PRMAuthorization"
  ],
  "policyChainId": "urn:prm:chain:uEiB6YYylUjeUKi1bZ-dI-udT6yZh2ZK_giAfoE-eGrbkxA",
  "boundPolicyHash": "uEiCDRPcf39RMK-jjyljqW1NsPAyDCuG9YMXmEmpOaJP73A",
  "grantee": {
    "name": "Example Data Controller",
    "id": "did:web:example.org",
    "did": "did:web:example.org",
    "domain": "example.org",
    "contact": "privacy@example.org"
  },
  "subjectRef": {
    "pairwiseId": "elouyups46bgssst",
    "disclosedIdentifiers": [
      {
        "namespace": "vin",
        "value": "1HGBH41JXMN109186",
        "salt": "1NjitacC6X2jApRc5vwPZg"
      }
    ]
  },
  "purposes": [
    "dpv:FraudPreventionAndDetection"
  ],
  "categories": [
    "prm:retention",
    "prm:correlation"
  ],
  "dataCategories": [
    "transaction-record"
  ],
  "issued": "2026-11-20T00:00:00Z",
  "expires": "2027-02-18T00:00:00Z",
  "maxRetention": "P90D",
  "onwardSharing": "prohibited",
  "revocation": {
    "statusListCredential": "https://rightsroot.com/status/1",
    "statusListIndex": 4211,
    "statusPurpose": "revocation"
  },
  "receiptRequested": true,
  "note": "Synthetic fixture. Scoped to a single stated purpose; no onward sharing.",
  "id": "urn:prm:authz:uEiAk_1XyrFxRrIgfeZWillgk7F2XDLdQH73xePIUW5ZYxA",
  "proof": {
    "type": "DataIntegrityProof",
    "cryptosuite": "eddsa-jcs-2022",
    "created": "2026-11-20T00:00:00Z",
    "verificationMethod": "did:key:z6MkrXkKJa4ytWRY9ZtJXK3k3o9dsrLdKYC5vhRbZjZfu4Zo#z6MkrXkKJa4ytWRY9ZtJXK3k3o9dsrLdKYC5vhRbZjZfu4Zo",
    "proofPurpose": "assertionMethod",
    "proofValue": "z5d4C6oVSTAKdkftZKQLUN3B7eUqJWCU137jcxpsXGVaZLXZWJEg4GHNqP6TFA4UnrFxn3sWcR5SQy7TFbWxPXRTG"
  }
}
