{
  "@context": [
    "https://www.w3.org/ns/credentials/v2",
    "https://prm.dev/ns/policy/v1"
  ],
  "type": [
    "VerifiableCredential",
    "PRMAuthorization"
  ],
  "policyChainId": "urn:prm:chain:uEiAS72lEsH_jjv-pVEQDAsha8xgPHEJ_5leXHgGr65hg-Q",
  "boundPolicyHash": "uEiC9_iVQZ_-ozuxuwrl4Uzo79pURYmwFNpB156ELrcV-rg",
  "grantee": {
    "name": "City of Whittier Police Department",
    "id": "did:web:whittierpd.org",
    "did": "did:web:whittierpd.org",
    "domain": "whittierpd.org",
    "contact": "records@whittierpd.org"
  },
  "subjectRef": {
    "pairwiseId": "6pyiopmj23qhvyc5",
    "disclosedIdentifiers": [
      {
        "namespace": "us-license-plate",
        "value": "US-CA-0EXAMPLE",
        "salt": "qMNe3DAjqBbp0fBQzvWTJw"
      }
    ]
  },
  "purposes": [
    "prm:records-request-identification"
  ],
  "categories": [
    "prm:transactional"
  ],
  "dataCategories": [
    "plate-read"
  ],
  "issued": "2026-09-16T16:00:00Z",
  "expires": "2027-03-15T00:00:00Z",
  "maxRetention": "P180D",
  "onwardSharing": "prohibited",
  "revocation": {
    "statusListCredential": "https://prm.app/status/1",
    "statusListIndex": 1,
    "statusPurpose": "revocation"
  },
  "receiptRequested": true,
  "note": "Issued solely so the recipient can identify which vehicle this notice concerns. It does not authorize retention, sharing, or any processing beyond that identification.",
  "id": "urn:prm:authz:uEiCywKn--64WcZ-QrKDkaeLPszA38Zuf1b1ceyczyHaLWw",
  "proof": {
    "type": "DataIntegrityProof",
    "cryptosuite": "eddsa-jcs-2022",
    "created": "2026-09-16T16:00:00Z",
    "verificationMethod": "did:key:z6MkfCwPTWq3SKbw4AVj7j8t8oFBiFp6CvZiTnXAw24nVkLH#z6MkfCwPTWq3SKbw4AVj7j8t8oFBiFp6CvZiTnXAw24nVkLH",
    "proofPurpose": "assertionMethod",
    "proofValue": "z4zxC1W4G9yqjtf2F8cmposnYgptJEqba7wNiB9SESNQ7x98hGYzChVKT36L5xrUJa1X3rmkL5QXYA1Y84KXqunJ1"
  }
}
